product_name,description,eligibility
Savings Account,A basic savings account with competitive interest rates.,All customers above 18 years old
Credit Card,A credit card with cashback and reward points.,"Credit score above 650 and income above $20,000"
Home Loan,Flexible home loan with low interest rates.,"Credit score above 700 and income above $50,000"
Education Loan,Loan for students pursuing higher education.,Age below 35 and enrollment in a valid institution
Fixed Deposit,Investment with fixed returns over a chosen term.,"Minimum deposit of $1,000"
